{
  "schema_version": "1.0",
  "spec_id": "SPEC-023",
  "contract_version": 2,
  "status": "done",
  "automatic_handoff": false,
  "execution": {
    "classification": "normal_implementation",
    "role": "developer",
    "model": "gpt-5.6-terra",
    "reasoning": "medium",
    "routing_rationale": "Architecture, ordering, acceptance, and validation are resolved.",
    "runtime_override": null,
    "working_directory": ".",
    "sandbox_mode": "workspace-write",
    "approval_mode": "auto_review",
    "thread": { "mode": "resume", "purpose": "implementation", "thread_id": "impl-terra-023" },
    "handoff_prompt": "Execute SPEC-023 without redesigning the public contract; return needs_design for any absent consequential decision."
  },
  "skills": [{ "name": "normalize-sensor-samples", "source": "project", "path": ".agents/skills/normalize-sensor-samples/SKILL.md", "required": true }],
  "references": [
    { "path": "docs/project/overview.md", "purpose": "project and provenance truth", "required": true },
    { "path": "docs/decisions/ADR-004-equal-timestamp-order.md", "purpose": "equal timestamp ordering", "required": true }
  ],
  "validation": [{ "id": "VAL-001", "kind": "test", "command": "python -m pytest tests/test_sensor_export.py -q", "required": true }],
  "review": { "required": true, "independence": "independent", "model": "gpt-5.6-sol", "reasoning": "high", "rationale": "Ordering and fields are a public integration contract." },
  "escalation": { "policy_version": "1.0", "allowed": ["terra_high", "needs_design", "sol_high"] },
  "completion": { "schema_path": ".codex/schemas/project-spec-completion.schema.json", "output_path": "specs/active/SPEC-023/evidence/completion.json" }
}
